{
 "schema": 1,
 "note": "Собран tools/build_wola_vocab.ts из content/modules/ch01/vocab.json и старого тренажёра. Руками не править: правь словари-источники или таблицы в скрипте и пересобери. Порядок vocab = порядок дневных порций (темы с place — не дома). tags[0] = тема.",
 "themes": [
  {
   "id": "powitania",
   "pl": "Powitania",
   "ru": "приветствия и вежливость"
  },
  {
   "id": "rozmowa",
   "pl": "Rozmowa",
   "ru": "фразы для разговора"
  },
  {
   "id": "ludzie",
   "pl": "Ludzie",
   "ru": "я и люди"
  },
  {
   "id": "miasto",
   "pl": "Miasto",
   "ru": "город и транспорт"
  },
  {
   "id": "liczby",
   "pl": "Liczby",
   "ru": "числа"
  },
  {
   "id": "zakupy",
   "pl": "Zakupy",
   "ru": "магазин и деньги"
  },
  {
   "id": "czas",
   "pl": "Czas",
   "ru": "время и дни"
  },
  {
   "id": "czasowniki",
   "pl": "Czasowniki",
   "ru": "глаголы и просьбы"
  },
  {
   "id": "dom",
   "pl": "Dom",
   "ru": "дом и услуги"
  },
  {
   "id": "praca",
   "pl": "Praca",
   "ru": "работа и документы"
  },
  {
   "id": "zdrowie",
   "pl": "Zdrowie",
   "ru": "здоровье и аптека"
  },
  {
   "id": "wolny",
   "pl": "Czas wolny",
   "ru": "досуг и погода"
  },
  {
   "id": "jedzenie",
   "pl": "Jedzenie",
   "ru": "еда и заказ (Salad Story)",
   "place": "salad"
  }
 ],
 "vocab": [
  {
   "id": "lx.dzien_dobry",
   "pl": "Dzień dobry",
   "ru": "здравствуйте, добрый день",
   "tr": "джень до́бры",
   "pos": "phrase",
   "srs": true,
   "ex": {
    "pl": "Dzień dobry, pani Aniu!",
    "ru": "Здравствуйте, пани Аня!"
   },
   "clusters": [
    "R5"
   ],
   "tags": [
    "powitania"
   ]
  },
  {
   "id": "lx.czesc",
   "pl": "cześć",
   "ru": "привет / пока",
   "tr": "чещчь",
   "pos": "phrase",
   "srs": true,
   "ex": {
    "pl": "Cześć, do jutra!",
    "ru": "Привет, до завтра!"
   },
   "clusters": [
    "R5",
    "R4"
   ],
   "tags": [
    "powitania"
   ]
  },
  {
   "id": "lx.dziekuje",
   "pl": "dziękuję",
   "ru": "спасибо",
   "tr": "джэнку́е",
   "pos": "phrase",
   "srs": true,
   "ex": {
    "pl": "Dziękuję bardzo!",
    "ru": "Большое спасибо!"
   },
   "clusters": [
    "R7",
    "R5"
   ],
   "tags": [
    "powitania"
   ]
  },
  {
   "id": "lx.prosze",
   "pl": "proszę",
   "ru": "пожалуйста; прошу",
   "tr": "про́шэ",
   "pos": "phrase",
   "srs": true,
   "ex": {
    "pl": "Proszę, to dla pana.",
    "ru": "Пожалуйста, это для вас."
   },
   "clusters": [
    "R7",
    "R4"
   ],
   "tags": [
    "powitania"
   ]
  },
  {
   "id": "lx.przepraszam",
   "pl": "przepraszam",
   "ru": "извините",
   "tr": "пшэпра́шам",
   "pos": "phrase",
   "srs": true,
   "ex": {
    "pl": "Przepraszam, gdzie jest metro?",
    "ru": "Извините, где метро?"
   },
   "clusters": [
    "R4",
    "R9"
   ],
   "tags": [
    "powitania"
   ]
  },
  {
   "id": "lx.tak",
   "pl": "Tak",
   "ru": "да",
   "tr": "так",
   "pos": "noun",
   "srs": true,
   "ex": {
    "pl": "Tak, oczywiście.",
    "ru": "Да, конечно."
   },
   "tags": [
    "powitania"
   ]
  },
  {
   "id": "lx.nie",
   "pl": "nie",
   "ru": "нет; не",
   "tr": "нье",
   "pos": "part",
   "srs": true,
   "ex": {
    "pl": "Nie, dziękuję.",
    "ru": "Нет, спасибо."
   },
   "clusters": [
    "R8"
   ],
   "tags": [
    "powitania"
   ]
  },
  {
   "id": "lx.nie_rozumiem",
   "pl": "Nie rozumiem",
   "ru": "Не понимаю",
   "tr": "нье розу́мьем",
   "pos": "phrase",
   "srs": true,
   "ex": {
    "pl": "Przepraszam, nie rozumiem.",
    "ru": "Извините, я не понимаю."
   },
   "clusters": [
    "R8"
   ],
   "tags": [
    "powitania"
   ]
  },
  {
   "id": "lx.do_widzenia",
   "pl": "Do widzenia",
   "ru": "до свидания",
   "tr": "до видзэня",
   "pos": "phrase",
   "srs": true,
   "ex": {
    "pl": "Dziękuję, do widzenia!",
    "ru": "Спасибо, до свидания!"
   },
   "tags": [
    "powitania"
   ]
  },
  {
   "id": "lx.dobry_wieczor",
   "pl": "Dobry wieczór",
   "ru": "добрый вечер",
   "tr": "добры вечур",
   "pos": "phrase",
   "srs": true,
   "ex": {
    "pl": "Dobry wieczór, jak się masz?",
    "ru": "Добрый вечер, как ты?"
   },
   "tags": [
    "powitania"
   ]
  },
  {
   "id": "lx.prosze_powtorzyc",
   "pl": "Proszę powtórzyć",
   "ru": "Повторите, пожалуйста",
   "tr": "про́шэ пофту́жычь",
   "pos": "phrase",
   "srs": true,
   "ex": {
    "pl": "Proszę powtórzyć.",
    "ru": "Повторите, пожалуйста."
   },
   "clusters": [
    "R9",
    "R10"
   ],
   "tags": [
    "rozmowa"
   ]
  },
  {
   "id": "lx.prosze_wolniej",
   "pl": "Proszę wolniej",
   "ru": "Помедленнее, пожалуйста",
   "tr": "про́шэ во́льней",
   "pos": "phrase",
   "srs": true,
   "clusters": [
    "R3"
   ],
   "tags": [
    "rozmowa"
   ]
  },
  {
   "id": "lx.co_to_znaczy",
   "pl": "Co to znaczy?",
   "ru": "Что это значит?",
   "tr": "цо то зна́чы",
   "pos": "phrase",
   "srs": true,
   "ex": {
    "pl": "Co to znaczy?",
    "ru": "Что это значит?"
   },
   "clusters": [
    "R2",
    "R4"
   ],
   "tags": [
    "rozmowa"
   ]
  },
  {
   "id": "lx.nie_mowie_po_polsku",
   "pl": "Nie mówię po polsku",
   "ru": "я не говорю по-польски",
   "tr": "не муве по польску",
   "pos": "phrase",
   "srs": true,
   "ex": {
    "pl": "Nie mówię po polsku, mówię po rosyjsku.",
    "ru": "Я не говорю по-польски, говорю по-русски."
   },
   "tags": [
    "powitania"
   ]
  },
  {
   "id": "lx.mam_na_imie",
   "pl": "Mam na imię",
   "ru": "меня зовут…",
   "tr": "мам на име",
   "pos": "phrase",
   "srs": true,
   "ex": {
    "pl": "Mam na imię Dima.",
    "ru": "Меня зовут Дима."
   },
   "tags": [
    "ludzie"
   ]
  },
  {
   "id": "lx.ja",
   "pl": "ja",
   "ru": "я",
   "tr": "я",
   "pos": "pron",
   "srs": true,
   "ex": {
    "pl": "Ja jestem z Rosji.",
    "ru": "Я из России."
   },
   "tags": [
    "ludzie"
   ]
  },
  {
   "id": "lx.jestem",
   "pl": "jestem",
   "ru": "я есть (быть)",
   "tr": "естэм",
   "pos": "noun",
   "srs": true,
   "ex": {
    "pl": "Jestem z Rosji.",
    "ru": "Я из России."
   },
   "tags": [
    "ludzie"
   ]
  },
  {
   "id": "lx.pan",
   "pl": "pan",
   "ru": "господин / вы (м)",
   "tr": "пан",
   "pos": "pron",
   "srs": true,
   "ex": {
    "pl": "Gdzie pan mieszka?",
    "ru": "Где вы живёте?"
   },
   "tags": [
    "ludzie"
   ]
  },
  {
   "id": "lx.pani",
   "pl": "pani",
   "ru": "госпожа / вы (ж)",
   "tr": "пани",
   "pos": "pron",
   "srs": true,
   "ex": {
    "pl": "Dzień dobry pani!",
    "ru": "Здравствуйте! (к женщине)"
   },
   "tags": [
    "ludzie"
   ]
  },
  {
   "id": "lx.milo_mi",
   "pl": "Miło mi",
   "ru": "приятно познакомиться",
   "tr": "мило ми",
   "pos": "phrase",
   "srs": true,
   "ex": {
    "pl": "Miło mi panią poznać.",
    "ru": "Приятно с вами познакомиться."
   },
   "tags": [
    "powitania"
   ]
  },
  {
   "id": "lx.gdzie",
   "pl": "gdzie",
   "ru": "где",
   "tr": "гдже",
   "pos": "pron",
   "srs": true,
   "ex": {
    "pl": "Gdzie mieszkasz?",
    "ru": "Где ты живёшь?"
   },
   "tags": [
    "ludzie"
   ]
  },
  {
   "id": "lx.gdzie_jest",
   "pl": "gdzie jest…?",
   "ru": "где находится…?",
   "tr": "гдже ест",
   "pos": "phrase",
   "srs": true,
   "ex": {
    "pl": "Gdzie jest apteka?",
    "ru": "Где аптека?"
   },
   "tags": [
    "miasto"
   ]
  },
  {
   "id": "lx.ulica",
   "pl": "ulica",
   "ru": "улица",
   "tr": "ули́ца",
   "pos": "noun",
   "srs": true,
   "gender": "f",
   "ex": {
    "pl": "Na tej ulicy.",
    "ru": "На этой улице."
   },
   "clusters": [
    "R2"
   ],
   "tags": [
    "miasto"
   ]
  },
  {
   "id": "lx.przystanek",
   "pl": "przystanek",
   "ru": "остановка",
   "tr": "пшыста́нэк",
   "pos": "noun",
   "srs": true,
   "gender": "m",
   "ex": {
    "pl": "Gdzie jest przystanek?",
    "ru": "Где остановка?"
   },
   "clusters": [
    "R9",
    "R4"
   ],
   "tags": [
    "miasto"
   ]
  },
  {
   "id": "lx.tramwaj",
   "pl": "tramwaj",
   "ru": "трамвай",
   "tr": "трамвай",
   "pos": "noun",
   "srs": true,
   "ex": {
    "pl": "Tramwaj numer pięć.",
    "ru": "Трамвай номер пять."
   },
   "tags": [
    "miasto"
   ]
  },
  {
   "id": "lx.metro",
   "pl": "metro",
   "ru": "метро",
   "tr": "метро",
   "pos": "noun",
   "srs": true,
   "ex": {
    "pl": "Gdzie jest metro?",
    "ru": "Где метро?"
   },
   "tags": [
    "miasto"
   ]
  },
  {
   "id": "lx.bilet",
   "pl": "bilet",
   "ru": "билет",
   "tr": "билет",
   "pos": "noun",
   "srs": true,
   "ex": {
    "pl": "Poproszę bilet.",
    "ru": "Билет, пожалуйста."
   },
   "tags": [
    "miasto"
   ]
  },
  {
   "id": "lx.wejscie",
   "pl": "wejście",
   "ru": "вход",
   "tr": "вэ́йщче",
   "pos": "sign",
   "srs": true,
   "clusters": [
    "R5"
   ],
   "tags": [
    "miasto"
   ]
  },
  {
   "id": "lx.wyjscie",
   "pl": "wyjście",
   "ru": "выход",
   "tr": "вы́йщче",
   "pos": "sign",
   "srs": true,
   "clusters": [
    "R5",
    "R2"
   ],
   "tags": [
    "miasto"
   ]
  },
  {
   "id": "lx.prosto",
   "pl": "prosto",
   "ru": "прямо",
   "tr": "просто",
   "pos": "adv",
   "srs": true,
   "ex": {
    "pl": "Idź prosto.",
    "ru": "Иди прямо."
   },
   "tags": [
    "miasto"
   ]
  },
  {
   "id": "lx.lewo",
   "pl": "lewo",
   "ru": "лево",
   "tr": "лево",
   "pos": "adv",
   "srs": true,
   "ex": {
    "pl": "W lewo.",
    "ru": "Налево."
   },
   "tags": [
    "miasto"
   ]
  },
  {
   "id": "lx.prawo",
   "pl": "prawo",
   "ru": "право",
   "tr": "право",
   "pos": "adv",
   "srs": true,
   "ex": {
    "pl": "W prawo.",
    "ru": "Направо."
   },
   "tags": [
    "miasto"
   ]
  },
  {
   "id": "lx.tu_tutaj",
   "pl": "tu / tutaj",
   "ru": "здесь",
   "tr": "ту / тутай",
   "pos": "adv",
   "srs": true,
   "ex": {
    "pl": "To jest tutaj.",
    "ru": "Это здесь."
   },
   "tags": [
    "miasto"
   ]
  },
  {
   "id": "lx.tam",
   "pl": "tam",
   "ru": "там",
   "tr": "там",
   "pos": "adv",
   "srs": true,
   "ex": {
    "pl": "Apteka jest tam.",
    "ru": "Аптека там."
   },
   "tags": [
    "miasto"
   ]
  },
  {
   "id": "lx.blisko",
   "pl": "blisko",
   "ru": "близко",